{
  "fixture_version": 1,
  "evidence_status": "synthetic_planning_baseline_not_market_evidence",
  "context_types": [
    "time_schedule",
    "activity_result",
    "content_consumption",
    "content_creation",
    "communication_relationship",
    "decision_commitment",
    "place_mobility",
    "body_state",
    "consumption_entertainment",
    "intent_feeling"
  ],
  "segments": [
    {
      "segment_id": "segment_t0_ai_worker",
      "priority": "T0",
      "label": "AI knowledge worker",
      "important_contexts": ["time_schedule", "activity_result", "content_creation", "communication_relationship", "decision_commitment"],
      "minimum_capability_ids": ["cap_explicit_capture", "cap_share", "cap_agent", "cap_calendar"],
      "scale_status": "not_estimated_market_scope_missing",
      "scale_blockers": ["launch_region", "platform_mix", "reachable_channel", "authorization_rate", "daily_source_use", "retention_evidence"]
    },
    {
      "segment_id": "segment_t1_communication",
      "priority": "T1",
      "label": "Communication-intensive professional",
      "important_contexts": ["time_schedule", "communication_relationship", "decision_commitment", "activity_result"],
      "minimum_capability_ids": ["cap_explicit_capture", "cap_share", "cap_calendar", "cap_meeting"],
      "scale_status": "not_estimated_market_scope_missing",
      "scale_blockers": ["launch_region", "platform_mix", "reachable_channel", "authorization_rate", "daily_source_use"]
    },
    {
      "segment_id": "segment_t1_learner_creator",
      "priority": "T1",
      "label": "Learner or creator",
      "important_contexts": ["content_consumption", "content_creation", "activity_result", "intent_feeling"],
      "minimum_capability_ids": ["cap_explicit_capture", "cap_share", "cap_browser"],
      "scale_status": "not_estimated_market_scope_missing",
      "scale_blockers": ["launch_region", "platform_mix", "reachable_channel", "authorization_rate", "daily_source_use"]
    },
    {
      "segment_id": "segment_t2_life_recorder",
      "priority": "T2",
      "label": "Everyday life recorder",
      "important_contexts": ["activity_result", "communication_relationship", "place_mobility", "consumption_entertainment", "intent_feeling"],
      "minimum_capability_ids": ["cap_explicit_capture", "cap_share", "cap_photo", "cap_calendar"],
      "scale_status": "not_estimated_market_scope_missing",
      "scale_blockers": ["launch_region", "platform_mix", "reachable_channel", "authorization_rate", "daily_source_use", "retention_evidence"]
    },
    {
      "segment_id": "segment_t2_quantified_vertical",
      "priority": "T2",
      "label": "Quantified-self or vertical-service user",
      "important_contexts": ["body_state", "place_mobility", "consumption_entertainment", "activity_result"],
      "minimum_capability_ids": ["cap_explicit_capture", "cap_health", "cap_location"],
      "scale_status": "not_estimated_market_scope_missing",
      "scale_blockers": ["launch_region", "platform_mix", "reachable_channel", "authorization_rate", "daily_source_use", "retention_evidence"]
    }
  ],
  "capabilities": [
    {
      "schema_version": 1,
      "capability_id": "cap_explicit_capture",
      "source_type": "text",
      "acquisition_mode": "one_action",
      "context_types": ["time_schedule", "activity_result", "content_consumption", "content_creation", "communication_relationship", "decision_commitment", "place_mobility", "body_state", "consumption_entertainment", "intent_feeling"],
      "field_claims": [
        {"field": "time", "authority": "supporting", "limitation": "Submission time does not prove the described event time."},
        {"field": "action", "authority": "strong", "limitation": "Authoritative for the user's own explicit statement, not independent external verification."},
        {"field": "result", "authority": "strong", "limitation": "Authoritative as a user assertion; platform outcomes still need source evidence."},
        {"field": "intent", "authority": "strong", "limitation": "Only the user can authoritatively express their intent."},
        {"field": "emotion", "authority": "strong", "limitation": "Only explicit user expression is accepted as authoritative."}
      ],
      "eligible_segment_ids": ["segment_t0_ai_worker", "segment_t1_communication", "segment_t1_learner_creator", "segment_t2_life_recorder", "segment_t2_quantified_vertical"],
      "priority": "P0",
      "permission_tier": "low",
      "bystander_risk": "low",
      "validation_status": "implemented_partial",
      "hard_gates": ["source_explanation", "explicit_permission", "pause_and_revoke", "lineage", "cascade_delete", "recovery", "real_device", "real_user"]
    },
    {
      "schema_version": 1,
      "capability_id": "cap_share",
      "source_type": "share",
      "acquisition_mode": "one_action",
      "context_types": ["content_consumption", "content_creation", "activity_result"],
      "field_claims": [
        {"field": "time", "authority": "supporting", "limitation": "Share time does not prove when the content was consumed."},
        {"field": "action", "authority": "supporting", "limitation": "Sharing proves selection, not reading, agreement or completion."},
        {"field": "intent", "authority": "weak", "limitation": "Importance and intended use require an optional user statement."}
      ],
      "eligible_segment_ids": ["segment_t0_ai_worker", "segment_t1_communication", "segment_t1_learner_creator", "segment_t2_life_recorder"],
      "priority": "P0",
      "permission_tier": "low",
      "bystander_risk": "low",
      "validation_status": "implemented_partial",
      "hard_gates": ["source_explanation", "explicit_permission", "lineage", "cascade_delete", "retention_limit", "recovery", "real_device", "real_user"]
    },
    {
      "schema_version": 1,
      "capability_id": "cap_agent",
      "source_type": "agent",
      "acquisition_mode": "scene_triggered",
      "context_types": ["activity_result", "content_creation", "decision_commitment"],
      "field_claims": [
        {"field": "time", "authority": "strong", "limitation": "Strong for tool execution time, not for external business events."},
        {"field": "action", "authority": "strong", "limitation": "Strong for actions executed in the authorized Agent task."},
        {"field": "result", "authority": "supporting", "limitation": "An Agent artifact does not prove deployment, acceptance or external completion."},
        {"field": "intent", "authority": "none", "limitation": "Agent behavior cannot replace explicit user intent."}
      ],
      "eligible_segment_ids": ["segment_t0_ai_worker", "segment_t1_learner_creator"],
      "priority": "P0",
      "permission_tier": "medium",
      "bystander_risk": "low",
      "validation_status": "implemented_partial",
      "hard_gates": ["source_explanation", "explicit_permission", "pause_and_revoke", "lineage", "cascade_delete", "platform_policy", "recovery", "real_user"]
    },
    {
      "schema_version": 1,
      "capability_id": "cap_calendar",
      "source_type": "calendar",
      "acquisition_mode": "automatic",
      "context_types": ["time_schedule", "communication_relationship"],
      "field_claims": [
        {"field": "time", "authority": "strong", "limitation": "Strong for planned time only."},
        {"field": "people", "authority": "supporting", "limitation": "Invitation does not prove attendance."},
        {"field": "action", "authority": "weak", "limitation": "A calendar entry is a plan, not proof that the event occurred."}
      ],
      "eligible_segment_ids": ["segment_t0_ai_worker", "segment_t1_communication", "segment_t1_learner_creator", "segment_t2_life_recorder"],
      "priority": "P0",
      "permission_tier": "medium",
      "bystander_risk": "medium",
      "validation_status": "implemented_partial",
      "hard_gates": ["source_explanation", "explicit_permission", "pause_and_revoke", "lineage", "cascade_delete", "retention_limit", "recovery", "real_device", "real_user"]
    },
    {
      "schema_version": 1,
      "capability_id": "cap_photo",
      "source_type": "photo",
      "acquisition_mode": "one_action",
      "context_types": ["activity_result", "communication_relationship", "place_mobility", "consumption_entertainment"],
      "field_claims": [
        {"field": "time", "authority": "supporting", "limitation": "Metadata may be missing, edited or refer to import time."},
        {"field": "place", "authority": "supporting", "limitation": "Location metadata may be absent or sensitive."},
        {"field": "people", "authority": "weak", "limitation": "Identity and relationship require confirmation."},
        {"field": "intent", "authority": "none", "limitation": "A photo cannot prove why the moment matters."}
      ],
      "eligible_segment_ids": ["segment_t1_learner_creator", "segment_t2_life_recorder"],
      "priority": "P1",
      "permission_tier": "medium",
      "bystander_risk": "medium",
      "validation_status": "implemented_partial",
      "hard_gates": ["source_explanation", "explicit_permission", "pause_and_revoke", "lineage", "cascade_delete", "retention_limit", "bystander_notice", "recovery", "real_device", "real_user"]
    },
    {
      "schema_version": 1,
      "capability_id": "cap_browser",
      "source_type": "browser",
      "acquisition_mode": "one_action",
      "context_types": ["content_consumption", "content_creation"],
      "field_claims": [
        {"field": "time", "authority": "supporting", "limitation": "Capture time does not prove full reading time."},
        {"field": "action", "authority": "supporting", "limitation": "One-click capture proves selection, not understanding."},
        {"field": "description", "authority": "strong", "limitation": "Strong only for the selected source excerpt and URL position."}
      ],
      "eligible_segment_ids": ["segment_t0_ai_worker", "segment_t1_learner_creator"],
      "priority": "P1",